{
  "requirement_id": "req-loan-precheck-smoke",
  "artifact_root": "artifacts/af/req-loan-precheck-smoke",
  "current_stage": "build",
  "stages": {
    "analyze": {
      "status": "complete",
      "outputs": [
        "analysis-result.json",
        "normalized-requirement.json",
        "module-candidates.json",
        "process-flow.json",
        "analysis-summary.md"
      ]
    },
    "design": {
      "status": "complete",
      "outputs": [
        "boundary-design.md",
        "commonization-notes.json",
        "a2a-contracts.json",
        "scaffold-plan.json"
      ]
    },
    "build": {
      "status": "complete",
      "outputs": [
        "runtime-stub/",
        "runtime-stub/scaffold-plan.json",
        "runtime-stub/implementation-handoff.md"
      ]
    },
    "verify": {
      "status": "complete",
      "outputs": [
        "validation-report.md",
        "catalog-delta.yaml"
      ]
    }
  },
  "approvals": {
    "analysis_reviewed": true,
    "boundaries_approved": true,
    "runtime_contracts_approved": true,
    "stub_ready_for_followup": true
  },
  "validation": {
    "commands": [
      "node scripts/validate-artifacts.mjs artifacts/af/req-loan-precheck-smoke",
      "node scripts/generate-adk-source.mjs artifacts/af/req-loan-precheck-smoke artifacts/af/req-loan-precheck-smoke/runtime-stub",
      "python3 -m compileall runtime-stub/req_loan_precheck_smoke_adk runtime-stub/tests",
      "cd runtime-stub/ && python -m pytest -q",
      "python3 -m compileall runtime-stub/req_loan_precheck_smoke_adk"
    ],
    "last_result": "passed"
  },
  "stage_runs": {
    "analyze": {
      "latest_run_id": "20260603T045337Z-analyze-2e46b5",
      "status": "completed",
      "started_at": "2026-06-03T04:53:37.231Z",
      "finished_at": "2026-06-03T04:56:22.908Z",
      "skill_name": "af-analyze-requirement",
      "model": "gpt-5.5",
      "output_artifacts": [
        "runs/analyze/20260603T045337Z-analyze-2e46b5/proposed-artifacts/analysis-result.json"
      ],
      "last_error": null
    },
    "design": {
      "latest_run_id": "20260604T042418Z-design-bb1304",
      "status": "completed",
      "started_at": "2026-06-04T04:24:18.866Z",
      "finished_at": "2026-06-04T04:28:22.785Z",
      "skill_name": "af-design-boundaries",
      "model": "gpt-5.5",
      "output_artifacts": [
        "runs/design/20260604T042418Z-design-bb1304/proposed-artifacts/analysis-result.json",
        "runs/design/20260604T042418Z-design-bb1304/proposed-artifacts/boundary-design.md"
      ],
      "last_error": null,
      "codex": {
        "backend": "sdk",
        "thread_id": "019e90df-fd95-79d0-be0a-750cf2fe3238",
        "event_count": 141
      }
    }
  }
}
