{
  "requirement_id": "req-001",
  "artifact_root": "artifacts/af/req-001",
  "current_stage": "design",
  "stages": {
    "analyze": {
      "status": "complete",
      "outputs": [
        "analysis-result.json"
      ]
    },
    "design": {
      "status": "complete",
      "outputs": [
        "boundary-design.md"
      ]
    },
    "build": {
      "status": "pending",
      "outputs": []
    },
    "verify": {
      "status": "pending",
      "outputs": []
    }
  },
  "approvals": {
    "analysis_reviewed": true,
    "boundaries_approved": true,
    "runtime_contracts_approved": true,
    "stub_ready_for_followup": false
  },
  "validation": {
    "commands": [],
    "last_result": "not_run"
  }
}
